ticker,company_title,cik,form,filing_date,accession,para_idx,para_text,neg_cnt,unc_cnt,n_tokens,neg_per_1000,unc_per_1000,company_tokens,company_neg_cnt,company_unc_cnt,company_neg_per_1000,company_unc_per_1000,external_tokens,external_neg_cnt,external_unc_cnt,external_neg_per_1000,external_unc_per_1000,company_sent_ratio,external_sent_ratio,finbert_neg,finbert_neu,finbert_pos
MSFT,MICROSOFT CORP,0000789019,10-Q,2021-04-27,000156459021020891,71,"The occurrence of regional epidemics or a global pandemic may adversely affect our operations, financial condition, and results of operations. The COVID-19 pandemic is having widespread, rapidly evolving, and unpredictable impacts on global society, economies, financial markets, and business practices. Federal and state governments have implemented measures in an effort to contain the virus, including social distancing, travel restrictions, border closures, limitations on public gatherings, work from home, supply chain logistical changes, and closure of non-essential businesses. To protect the health and well-being of our employees, suppliers, and customers, we have made substantial modifications to employee travel policies, implemented office closures as employees are advised to work from home, and cancelled or shifted our conferences and other marketing events to virtual-only through fiscal year 2021. The COVID-19 pandemic has impacted and may continue to impact our business operations, including our employees, customers, partners, and communities, and there is substantial uncertainty in the nature and degree of its continued effects over time.",7,4,159,44.0251572327044,25.157232704402517,102,3,3,29.41176470588235,29.41176470588235,57,4,1,70.17543859649123,17.54385964912281,0.6,0.2,0.014362987130880356,0.8791447281837463,0.10649238526821136
MSFT,MICROSOFT CORP,0000789019,10-Q,2021-04-27,000156459021020891,72,"Since the COVID-19 pandemic began, we have experienced a range of impacts on our business, including adverse impacts to our supply chain and a slowdown in transactional licensing. The extent to which the COVID-19 pandemic impacts our business going forward will depend on numerous evolving factors we cannot reliably predict, including the duration and scope of the pandemic; governmental, business, and individuals' actions in response to the pandemic; and the impact on economic activity including the possibility of recession or financial market instability. These factors may adversely impact consumer, business, and government spending on technology as well as customers' ability to pay for our products and services on an ongoing basis. This uncertainty also affects management’s accounting estimates and assumptions, which could result in greater variability in a variety of areas that depend on these estimates and assumptions, including investments, receivables, and forward-looking guidance.",5,11,141,35.46099290780142,78.01418439716312,109,5,5,45.87155963302752,45.87155963302752,32,0,6,0.0,187.5,0.75,0.0,0.015162643976509571,0.8439427614212036,0.14089463651180267
MSFT,MICROSOFT CORP,0000789019,10-Q,2021-04-27,000156459021020891,73,"Measures to contain the virus that impact us, our partners, distributors, and suppliers may further intensify these impacts and other risks described in these Risk Factors. Any of these may adversely impact our ability to:",1,4,35,28.571428571428573,114.28571428571429,35,1,4,28.571428571428573,114.28571428571429,0,0,0,0.0,0.0,1.0,0.0,0.02903391793370247,0.4130060076713562,0.5579600930213928
MSFT,MICROSOFT CORP,0000789019,10-Q,2021-04-27,000156459021020891,74,"We may incur increased costs to effectively manage these aspects of our business. If we are unsuccessful it may adversely impact our revenues, cash flows, market share growth, and reputation.",2,2,30,66.66666666666667,66.66666666666667,30,2,2,66.66666666666667,66.66666666666667,0,0,0,0.0,0.0,1.0,0.0,0.015555169433355331,0.9355242252349854,0.048920638859272
MSFT,MICROSOFT CORP,0000789019,10-Q,2021-04-27,000156459021020891,75,"The long-term effects of climate change on the global economy and the IT industry in particular are unclear. Environmental regulations or changes in the supply, demand or available sources of energy or other resources may affect the availability or cost of goods and services, including natural resources, necessary to run our business. Changes in climate where we operate may increase the costs of powering and cooling computer hardware we use to develop software and provide cloud-based services.",0,3,77,0.0,38.96103896103896,59,0,2,0.0,33.898305084745765,18,0,1,0.0,55.55555555555556,0.6666666666666666,0.3333333333333333,0.022720346227288246,0.6940997838973999,0.2831798791885376
MSFT,MICROSOFT CORP,0000789019,10-Q,2021-04-27,000156459021020891,76,"Our global business exposes us to operational and economic risks.
 Our customers are located throughout the world and a significant part of our revenue comes from international sales. The global nature of our business creates operational, economic, and geopolitical risks. Our results of operations may be affected by global, regional, and local economic developments, monetary policy, inflation, and recession, as well as political and military disputes. In addition, our international growth strategy includes certain markets, the developing nature of which presents several risks, including deterioration of social, political, labor, or economic conditions in a country or region, and difficulties in staffing and managing foreign operations. Emerging nationalist and protectionist trends in specific countries may significantly alter the trade and commercial environments. Changes to trade policy or agreements as a result of populism, protectionism, or economic nationalism may result in higher tariffs, local sourcing initiatives, or other developments that make it more difficult to sell our products in foreign countries. Disruptions of these kinds in developed or emerging markets could negatively impact demand for our products and services or increase operating costs. Although we hedge a portion of our international currency exposure, significant fluctuations in foreign exchange rates between the U.S. dollar and foreign currencies may adversely affect our results of operations.",9,10,206,43.689320388349515,48.54368932038835,190,9,9,47.36842105263158,47.36842105263158,16,0,1,0.0,62.5,0.9,0.0,0.017350519075989723,0.8606589436531067,0.12199047207832336
MSFT,MICROSOFT CORP,0000789019,10-Q,2021-04-27,000156459021020891,77,"Our business depends on our ability to attract and retain talented employees.
 Our business is based on successfully attracting and retaining talented employees representing diverse backgrounds, experiences, and skill sets. The market for highly skilled workers and leaders in our industry is extremely competitive. Maintaining our brand and reputation, as well as a diverse and inclusive work environment that enables all our employees to thrive, are important to our ability to recruit and retain employees. We are also limited in our ability to recruit internationally by restrictive domestic immigration laws. Changes to U.S. immigration policies that restrain the flow of technical and professional talent may inhibit our ability to adequately staff our research and development efforts. If we are less successful in our recruiting efforts, or if we cannot retain highly skilled workers and key leaders, our ability to develop and deliver successful products and services may be adversely affected. Effective succession planning is also important to our long-term success. Failure to ensure effective transfer of knowledge and smooth transitions involving key employees could hinder our strategic planning and execution. How employment-related laws are interpreted and applied to our workforce practices may result in increased operating costs and less flexibility in how we meet our workforce needs.",3,5,205,14.634146341463415,24.390243902439025,203,3,5,14.77832512315271,24.63054187192118,2,0,0,0.0,0.0,0.9090909090909091,0.0,0.01307948213070631,0.93140709400177,0.05551345646381378
MSFT,MICROSOFT CORP,0000789019,10-Q,2021-01-26,000156459021002316,1,"Our operations and financial results are subject to various risks and uncertainties, including those described below, that could adversely affect our business, financial condition, results of operations, cash flows, and the trading price of our common stock.",1,3,37,27.027027027027028,81.08108108108108,37,1,3,27.027027027027028,81.08108108108108,0,0,0,0.0,0.0,1.0,0.0,0.021197810769081116,0.49855199456214905,0.48025017976760864
MSFT,MICROSOFT CORP,0000789019,10-Q,2021-01-26,000156459021002316,2,"We face intense competition across all markets for our products and services, which may lead to lower revenue or operating margins.",0,1,21,0.0,47.61904761904762,21,0,1,0.0,47.61904761904762,0,0,0,0.0,0.0,1.0,0.0,0.011374497786164284,0.9649162888526917,0.023709231987595558
MSFT,MICROSOFT CORP,0000789019,10-Q,2021-01-26,000156459021002316,3,Competition in the technology sector,0,0,5,0.0,0.0,0,0,0,0.0,0.0,5,0,0,0.0,0.0,0.0,0.0,0.13126273453235626,0.0308957751840353,0.8378415107727051
MSFT,MICROSOFT CORP,0000789019,10-Q,2021-01-26,000156459021002316,4,"Our competitors range in size from diversified global companies with significant research and development resources to small, specialized firms whose narrower product lines may let them be more effective in deploying technical, marketing, and financial resources. Barriers to entry in many of our businesses are low and many of the areas in which we compete evolve rapidly with changing and disruptive technologies, shifting user needs, and frequent introductions of new products and services. Our ability to remain competitive depends on our success in making innovative products, devices, and services that appeal to businesses and consumers.",2,2,95,21.05263157894737,21.05263157894737,95,2,2,21.05263157894737,21.05263157894737,0,0,0,0.0,0.0,1.0,0.0,0.2381293624639511,0.01148747093975544,0.750383198261261
MSFT,MICROSOFT CORP,0000789019,10-Q,2021-01-26,000156459021002316,5,"An important element of our business model has been to create platform-based ecosystems on which many participants can build diverse solutions. A well-established ecosystem creates beneficial network effects among users, application developers, and the platform provider that can accelerate growth. Establishing significant scale in the marketplace is necessary to achieve and maintain attractive margins. We face significant competition from firms that provide competing platforms.",0,0,63,0.0,0.0,31,0,0,0.0,0.0,32,0,0,0.0,0.0,0.5,0.25,0.5450028777122498,0.02744387835264206,0.42755326628685
MSFT,MICROSOFT CORP,0000789019,10-Q,2021-01-26,000156459021002316,6,Companies compete with us based on a growing variety of business models.,0,0,11,0.0,0.0,11,0,0,0.0,0.0,0,0,0,0.0,0.0,1.0,0.0,0.25240153074264526,0.008392219431698322,0.7392062544822693
MSFT,MICROSOFT CORP,0000789019,10-Q,2021-01-26,000156459021002316,7,"The competitive pressures described above may cause decreased sales volumes, price reductions, and/or increased operating costs, such as for research and development, marketing, and sales incentives. This may lead to lower revenue, gross margins, and operating income.",0,2,38,0.0,52.63157894736842,0,0,0,0.0,0.0,38,0,2,0.0,52.63157894736842,0.0,0.0,0.00909449253231287,0.9611247181892395,0.029780764132738113
MSFT,MICROSOFT CORP,0000789019,10-Q,2021-01-26,000156459021002316,8,"Our increasing focus on cloud-based services presents execution and competitive risks.
 A growing part of our business involves cloud-based services available across the spectrum of computing devices. Our strategic vision is to compete and grow by building best-in-class platforms and productivity services for an intelligent cloud and an intelligent edge infused with artificial intelligence (“AI”). At the same time, our competitors are rapidly developing and deploying cloud-based services for consumers and business customers. Pricing and delivery models are evolving. Devices and form factors influence how users access services in the cloud and sometimes the user’s choice of which cloud-based services to use. We are devoting significant resources to develop and deploy our cloud-based strategies. The Windows ecosystem must continue to evolve with this changing environment. We embrace cultural and organizational changes to drive accountability and eliminate obstacles to innovation. Our intelligent cloud and intelligent edge worldview is connected with the growth of the Internet of Things (“IoT”). Our success in the IoT will depend on the level of adoption of our offerings such as Azure, Azure Stack, Azure IoT Edge, and Azure Sphere. We may not establish market share sufficient to achieve scale necessary to achieve our business objectives.",1,4,198,5.05050505050505,20.2020202020202,158,1,3,6.329113924050633,18.9873417721519,40,0,1,0.0,25.0,0.75,0.0,0.10549841821193695,0.015421871095895767,0.8790797591209412
MSFT,MICROSOFT CORP,0000789019,10-Q,2021-01-26,000156459021002316,9,"Besides software development costs, we are incurring costs to build and maintain infrastructure to support cloud computing services. These costs will reduce the operating margins we have previously achieved. Whether we succeed in cloud-based services depends on our execution in several areas, including:",0,1,43,0.0,23.25581395348837,43,0,1,0.0,23.25581395348837,0,0,0,0.0,0.0,1.0,0.0,0.1982170194387436,0.4237973392009735,0.3779856860637665
MSFT,MICROSOFT CORP,0000789019,10-Q,2021-01-26,000156459021002316,10,"It is uncertain whether our strategies will attract the users or generate the revenue required to succeed. If we are not effective in executing organizational and technical changes to increase efficiency and accelerate innovation, or if we fail to generate sufficient usage of our new products and services, we may not grow revenue in line with the infrastructure and development investments described above. This may negatively impact gross margins and operating income.",2,3,72,27.77777777777778,41.666666666666664,63,1,2,15.873015873015873,31.746031746031747,9,1,1,111.11111111111111,111.11111111111111,0.6666666666666666,0.0,0.039706289768218994,0.8352699875831604,0.125023752450943
MSFT,MICROSOFT CORP,0000789019,10-Q,2021-01-26,000156459021002316,11,RISKS RELATING TO THE EVOLUTION OF OUR BUSINESS,0,1,8,0.0,125.0,8,0,1,0.0,125.0,0,0,0,0.0,0.0,1.0,0.0,0.07569819688796997,0.02039198949933052,0.9039097428321838
MSFT,MICROSOFT CORP,0000789019,10-Q,2021-01-26,000156459021002316,12,"We make significant investments in products and services that may not achieve expected returns.
 We will continue to make significant investments in research, development, and marketing for existing products, services, and technologies, including the Windows operating system, Microsoft 365, Office, Bing, SQL Server, Windows Server, Azure, Office 365, Xbox Live, LinkedIn, and other products and services. We also invest in the development and acquisition of a variety of hardware for productivity, communication, and entertainment including PCs, tablets, gaming devices, and HoloLens. Investments in new technology are speculative. Commercial success depends on many factors, including innovativeness, developer support, and effective distribution and marketing. If customers do not perceive our latest offerings as providing significant new functionality or other value, they may reduce their purchases of new software and hardware products or upgrades, unfavorably affecting revenue. We may not achieve significant revenue from new product, service, and distribution channel investments for several years, if at all. New products and services may not be profitable, and even if they are profitable, operating margins for some new products and businesses will not be as high as the margins we have experienced historically. We may not get engagement in certain features, like Edge and Bing, that drive post-sale monetization opportunities. Our data handling practices across our products and services will continue to be under scrutiny and perceptions of mismanagement, driven by regulatory activity or negative public reaction to our practices or product experiences, which could negatively impact product and feature adoption, product design, and product quality.",5,8,248,20.161290322580644,32.25806451612903,227,5,6,22.026431718061673,26.431718061674008,21,0,2,0.0,95.23809523809524,0.8,0.0,0.2011399120092392,0.08543428033590317,0.7134257555007935
MSFT,MICROSOFT CORP,0000789019,10-Q,2021-01-26,000156459021002316,13,Developing new technologies is complex. It can require long development and testing periods. Significant delays in new releases or significant problems in creating new products or services could adversely affect our revenue.,3,1,32,93.75,31.25,19,3,1,157.89473684210526,52.63157894736842,13,0,0,0.0,0.0,0.3333333333333333,0.0,0.012364358641207218,0.9094663262367249,0.07816928625106812
MSFT,MICROSOFT CORP,0000789019,10-Q,2021-01-26,000156459021002316,14,"Acquisitions, joint ventures, and strategic alliances may have an adverse effect on our business.
 We expect to continue making acquisitions and entering into joint ventures and strategic alliances as part of our long-term business strategy. For example, in October 2018, we completed our acquisition of GitHub, Inc. (“GitHub”) for $7.5 billion. These acquisitions and other transactions and arrangements involve significant challenges and risks, including that they do not advance our business strategy, that we get an unsatisfactory return on our investment, that we have difficulty integrating and retaining new employees, business systems, and technology, or that they distract management from our other businesses. If an arrangement fails to adequately anticipate changing circumstances and interests of a party, it may result in early termination or renegotiation of the arrangement. The success of these transactions and arrangements will depend in part on our ability to leverage them to enhance our existing products and services or develop compelling new ones. It may take longer than expected to realize the full benefits from these transactions and arrangements such as increased revenue or enhanced efficiencies, or the benefits may ultimately be smaller than we expected. These events could adversely affect our consolidated financial statements.",9,8,196,45.91836734693877,40.816326530612244,169,6,6,35.50295857988166,35.50295857988166,27,3,2,111.11111111111111,74.07407407407408,0.7777777777777778,0.0,0.01454070582985878,0.9193775057792664,0.06608182191848755
MSFT,MICROSOFT CORP,0000789019,10-Q,2021-01-26,000156459021002316,15,"If our goodwill or amortizable intangible assets become impaired, we may be required to record a significant charge to earnings.
 We acquire other companies and intangible assets and may not realize all the economic benefit from those acquisitions, which could cause an impairment of goodwill or intangibles. We review our amortizable intangible assets for impairment when events or changes in circumstances indicate the carrying value may not be recoverable. We test goodwill for impairment at least annually. Factors that may be a change in circumstances, indicating that the carrying value of our goodwill or amortizable intangible assets may not be recoverable, include a decline in our stock price and market capitalization, reduced future cash flow estimates, and slower growth rates in industry segments in which we participate. We have in the past recorded, and may in the future be required to record, a significant charge in our consolidated financial statements during the period in which any impairment of our goodwill or amortizable intangible assets is determined, negatively affecting our results of operations.",8,13,168,47.61904761904762,77.38095238095238,168,8,13,47.61904761904762,77.38095238095238,0,0,0,0.0,0.0,1.0,0.0,0.01780836470425129,0.8705050349235535,0.11168660968542099
MSFT,MICROSOFT CORP,0000789019,10-Q,2021-01-26,000156459021002316,16,"CYBERSECURITY, DATA PRIVACY, AND PLATFORM ABUSE RISKS",1,1,7,142.85714285714286,142.85714285714286,0,0,0,0.0,0.0,7,1,1,142.85714285714286,142.85714285714286,0.0,0.0,0.021426787599921227,0.3519172668457031,0.6266559362411499
MSFT,MICROSOFT CORP,0000789019,10-Q,2021-01-26,000156459021002316,17,"Cyberattacks and security vulnerabilities could lead to reduced revenue, increased costs, liability claims, or harm to our reputation or competitive position.",4,1,21,190.47619047619048,47.61904761904762,21,4,1,190.47619047619048,47.61904761904762,0,0,0,0.0,0.0,1.0,0.0,0.009869969449937344,0.9655466079711914,0.02458341419696808
MSFT,MICROSOFT CORP,0000789019,10-Q,2021-01-26,000156459021002316,18,Security of our information technology,0,0,5,0.0,0.0,5,0,0,0.0,0.0,0,0,0,0.0,0.0,1.0,0.0,0.050908710807561874,0.02261553704738617,0.9264757633209229
MSFT,MICROSOFT CORP,0000789019,10-Q,2021-01-26,000156459021002316,19,"Threats to IT security can take a variety of forms. Individual and groups of hackers and sophisticated organizations, including state-sponsored organizations or nation-states, continuously undertake attacks that pose threats to our customers and our IT. These actors may use a wide variety of methods, which may include developing and deploying malicious software or exploiting vulnerabilities in hardware, software, or other infrastructure in order to attack our products and services or gain access to our networks and datacenters, using social engineering techniques to induce our employees, users, partners, or customers to disclose passwords or other sensitive information or take other actions to gain access to our data or our users’ or customers’ data, or acting in a coordinated manner to launch distributed denial of service or other coordinated attacks. Inadequate account security practices may also result in unauthorized access to confidential data. For example, system administrators may fail to timely remove employee account access when no longer appropriate. Employees or third parties may intentionally compromise our or our users’ security or systems, or reveal confidential information. Malicious actors may employ the IT supply chain to introduce malware through software updates or compromised supplier accounts or hardware.",11,6,192,57.291666666666664,31.25,134,6,3,44.776119402985074,22.388059701492537,58,5,3,86.20689655172414,51.724137931034484,0.42857142857142855,0.14285714285714285,0.018254179507493973,0.6103081107139587,0.37143775820732117
MSFT,MICROSOFT CORP,0000789019,10-Q,2021-01-26,000156459021002316,20,"Cyberthreats are constantly evolving, increasing the difficulty of detecting and successfully defending against them. We may have no current capability to detect certain vulnerabilities, which may allow them to persist in the environment over long periods of time. Cyberthreats can have cascading impacts that unfold with increasing speed across our internal networks and systems and those of our partners and customers. Breaches of our facilities, network, or data security could disrupt the security of our systems and business applications, impair our ability to provide services to our customers and protect the privacy of their data, result in product development delays, compromise confidential or technical business information harming our reputation or competitive position, result in theft or misuse of our intellectual property or other assets, require us to allocate more resources to improve technologies, or otherwise adversely affect our business.",12,3,139,86.33093525179856,21.58273381294964,125,9,3,72.0,24.0,14,3,0,214.28571428571428,0.0,0.75,0.0,0.010539432987570763,0.9152449369430542,0.07421564310789108
MSFT,MICROSOFT CORP,0000789019,10-Q,2021-01-26,000156459021002316,21,"The cyberattacks uncovered in late 2020 known as “Solorigate” are an example of a supply chain attack where malware was introduced to a software provider’s customers, including us, through software updates. The attackers were later able to create false credentials that appeared
 
legitimate to certain customers’ systems. We may be targets of further attacks similar to Solorigate as both a supplier and consumer of IT.",4,2,61,65.57377049180327,32.78688524590164,45,3,1,66.66666666666667,22.22222222222222,16,1,1,62.5,62.5,0.5,0.25,0.029096506536006927,0.34480467438697815,0.6260988116264343
MSFT,MICROSOFT CORP,0000789019,10-Q,2021-01-26,000156459021002316,22,"In addition, our internal IT environment continues to evolve. Often, we are early adopters of new devices and technologies. We embrace new ways of sharing data and communicating internally and with partners and customers using methods such as social networking and other consumer-oriented technologies. Our business policies and internal security controls may not keep pace with these changes as new threats emerge.",1,1,62,16.129032258064516,16.129032258064516,62,1,1,16.129032258064516,16.129032258064516,0,0,0,0.0,0.0,1.0,0.0,0.17224788665771484,0.05257802829146385,0.7751740217208862
MSFT,MICROSOFT CORP,0000789019,10-Q,2021-01-26,000156459021002316,23,"Security of our products, services, devices, and customers’ data",0,0,9,0.0,0.0,9,0,0,0.0,0.0,0,0,0,0.0,0.0,1.0,0.0,0.04638952761888504,0.01800697110593319,0.9356034994125366
