ticker,company_title,cik,form,filing_date,accession,para_idx,para_text,neg_cnt,unc_cnt,n_tokens,neg_per_1000,unc_per_1000,company_tokens,company_neg_cnt,company_unc_cnt,company_neg_per_1000,company_unc_per_1000,external_tokens,external_neg_cnt,external_unc_cnt,external_neg_per_1000,external_unc_per_1000,company_sent_ratio,external_sent_ratio,finbert_neg,finbert_neu,finbert_pos
MSFT,MICROSOFT CORP,0000789019,10-Q,2023-01-24,000156459023000733,1,"Our operations and financial results are subject to various risks and uncertainties, including those described below, that could adversely affect our business, financial condition, results of operations, cash flows, and the trading price of our common stock.",1,3,37,27.027027027027028,81.08108108108108,37,1,3,27.027027027027028,81.08108108108108,0,0,0,0.0,0.0,1.0,0.0,0.021197810769081116,0.49855199456214905,0.48025017976760864
MSFT,MICROSOFT CORP,0000789019,10-Q,2023-01-24,000156459023000733,2,"We face intense competition across all markets for our products and services, which may lead to lower revenue or operating margins.",0,1,21,0.0,47.61904761904762,21,0,1,0.0,47.61904761904762,0,0,0,0.0,0.0,1.0,0.0,0.011374497786164284,0.9649162888526917,0.023709231987595558
MSFT,MICROSOFT CORP,0000789019,10-Q,2023-01-24,000156459023000733,3,Competition in the technology sector,0,0,5,0.0,0.0,0,0,0,0.0,0.0,5,0,0,0.0,0.0,0.0,0.0,0.13126273453235626,0.0308957751840353,0.8378415107727051
MSFT,MICROSOFT CORP,0000789019,10-Q,2023-01-24,000156459023000733,4,"Our competitors range in size from diversified global companies with significant research and development resources to small, specialized firms whose narrower product lines may let them be more effective in deploying technical, marketing, and financial resources. Barriers to entry in many of our businesses are low and many of the areas in which we compete evolve rapidly with changing and disruptive technologies, shifting user needs, and frequent introductions of new products and services. Our ability to remain competitive depends on our success in making innovative products, devices, and services that appeal to businesses and consumers.",2,2,95,21.05263157894737,21.05263157894737,95,2,2,21.05263157894737,21.05263157894737,0,0,0,0.0,0.0,1.0,0.0,0.2381293624639511,0.01148747093975544,0.750383198261261
MSFT,MICROSOFT CORP,0000789019,10-Q,2023-01-24,000156459023000733,5,"An important element of our business model has been to create platform-based ecosystems on which many participants can build diverse solutions. A well-established ecosystem creates beneficial network effects among users, application developers, and the platform provider that can accelerate growth. Establishing significant scale in the marketplace is necessary to achieve and maintain attractive margins. We face significant competition from firms that provide competing platforms.",0,0,63,0.0,0.0,31,0,0,0.0,0.0,32,0,0,0.0,0.0,0.5,0.25,0.5450028777122498,0.02744387835264206,0.42755326628685
MSFT,MICROSOFT CORP,0000789019,10-Q,2023-01-24,000156459023000733,6,Companies compete with us based on a growing variety of business models.,0,0,11,0.0,0.0,11,0,0,0.0,0.0,0,0,0,0.0,0.0,1.0,0.0,0.25240153074264526,0.008392219431698322,0.7392062544822693
MSFT,MICROSOFT CORP,0000789019,10-Q,2023-01-24,000156459023000733,7,"The competitive pressures described above may cause decreased sales volumes, price reductions, and/or increased operating costs, such as for research and development, marketing, and sales incentives. This may lead to lower revenue, gross margins, and operating income.",0,2,38,0.0,52.63157894736842,0,0,0,0.0,0.0,38,0,2,0.0,52.63157894736842,0.0,0.0,0.00909449253231287,0.9611247181892395,0.029780764132738113
MSFT,MICROSOFT CORP,0000789019,10-Q,2023-01-24,000156459023000733,8,"Our increasing focus on cloud-based services presents execution and competitive risks.
 A growing part of our business involves cloud-based services available across the spectrum of computing devices. Our strategic vision is to compete and grow by building best-in-class platforms and productivity services for an intelligent cloud and an intelligent edge infused with artificial intelligence (“AI”). At the same time, our competitors are rapidly developing and deploying cloud-based services for consumers and business customers. Pricing and delivery models are evolving. Devices and form factors influence how users access services in the cloud and sometimes the user’s choice of which cloud-based services to use. We are devoting significant resources to develop and deploy our cloud-based strategies. The Windows ecosystem must continue to evolve with this changing environment. We embrace cultural and organizational changes to drive accountability and eliminate obstacles to innovation. Our intelligent cloud and intelligent edge worldview is connected with the growth of the Internet of Things (“IoT”), a network of distributed and interconnected devices employing sensors, data, and computing capabilities, including AI. Our success in the IoT will depend on the level of adoption of our offerings such as Azure, Azure Stack, Azure IoT Edge, and Azure Sphere. We may not establish market share sufficient to achieve scale necessary to meet our business objectives.",1,4,212,4.716981132075472,18.867924528301888,172,1,3,5.813953488372093,17.441860465116278,40,0,1,0.0,25.0,0.75,0.0,0.13332393765449524,0.012223186902701855,0.8544528484344482
MSFT,MICROSOFT CORP,0000789019,10-Q,2023-01-24,000156459023000733,9,"Besides software development costs, we are incurring costs to build and maintain infrastructure to support cloud computing services. These costs will reduce the operating margins we have previously achieved. Whether we succeed in cloud-based services depends on our execution in several areas, including:",0,1,43,0.0,23.25581395348837,43,0,1,0.0,23.25581395348837,0,0,0,0.0,0.0,1.0,0.0,0.1982170194387436,0.4237973392009735,0.3779856860637665
MSFT,MICROSOFT CORP,0000789019,10-Q,2023-01-24,000156459023000733,10,"It is uncertain whether our strategies will attract the users or generate the revenue required to succeed. If we are not effective in executing organizational and technical changes to increase efficiency and accelerate innovation, or if we fail to generate sufficient usage of our new products and services, we may not grow revenue in line with the infrastructure and development investments described above. This may negatively impact gross margins and operating income.",2,3,72,27.77777777777778,41.666666666666664,63,1,2,15.873015873015873,31.746031746031747,9,1,1,111.11111111111111,111.11111111111111,0.6666666666666666,0.0,0.039706289768218994,0.8352699875831604,0.125023752450943
MSFT,MICROSOFT CORP,0000789019,10-Q,2023-01-24,000156459023000733,11,"Some users may engage in fraudulent or abusive activities through our cloud-based services. These include unauthorized use of accounts through stolen credentials, use of stolen credit cards or other payment vehicles, failure to pay for services accessed, or other activities that violate our terms of service such as cryptocurrency mining or launching cyberattacks. If our efforts to detect such violations or our actions to control these types of fraud and abuse are not effective, we may experience adverse impacts to our revenue or incur reputational damage.",13,2,86,151.1627906976744,23.25581395348837,86,13,2,151.1627906976744,23.25581395348837,0,0,0,0.0,0.0,1.0,0.0,0.013699882663786411,0.8635745048522949,0.12272565066814423
MSFT,MICROSOFT CORP,0000789019,10-Q,2023-01-24,000156459023000733,12,RISKS RELATING TO THE EVOLUTION OF OUR BUSINESS,0,1,8,0.0,125.0,8,0,1,0.0,125.0,0,0,0,0.0,0.0,1.0,0.0,0.07569821178913116,0.02039199508726597,0.9039097428321838
MSFT,MICROSOFT CORP,0000789019,10-Q,2023-01-24,000156459023000733,13,"We make significant investments in products and services that may not achieve expected returns.
 We will continue to make significant investments in research, development, and marketing for existing products, services, and technologies, including the Windows operating system, Microsoft 365, Bing, SQL Server, Windows Server, Azure, Office 365, Xbox, LinkedIn, and other products and services. We also invest in the development and acquisition of a variety of hardware for productivity, communication, and entertainment, including PCs, tablets, gaming devices, and HoloLens. Investments in new technology are speculative. Commercial success depends on many factors, including innovativeness, developer support, and effective distribution and marketing. If customers do not perceive our latest offerings as providing significant new functionality or other value, they may reduce their purchases of new software and hardware products or upgrades, unfavorably affecting revenue. We may not achieve significant revenue from new product, service, and distribution channel investments for several years, if at all. New products and services may not be profitable, and even if they are profitable, operating margins for some new products and businesses will not be as high as the margins we have experienced historically. We may not get engagement in certain features, like Edge and Bing, that drive post-sale monetization opportunities. Our data handling practices across our products and services will continue to be under scrutiny. Perceptions of mismanagement, driven by regulatory activity or negative public reaction to our practices or product experiences, could negatively impact product and feature adoption, product design, and product quality.",5,8,244,20.491803278688526,32.78688524590164,223,5,6,22.42152466367713,26.905829596412556,21,0,2,0.0,95.23809523809524,0.8181818181818182,0.0,0.16395261883735657,0.09494656324386597,0.7411008477210999
MSFT,MICROSOFT CORP,0000789019,10-Q,2023-01-24,000156459023000733,14,Developing new technologies is complex. It can require long development and testing periods. Significant delays in new releases or significant problems in creating new products or services could adversely affect our revenue.,3,1,32,93.75,31.25,19,3,1,157.89473684210526,52.63157894736842,13,0,0,0.0,0.0,0.3333333333333333,0.0,0.012364358641207218,0.9094663262367249,0.07816928625106812
MSFT,MICROSOFT CORP,0000789019,10-Q,2023-01-24,000156459023000733,15,"Acquisitions, joint ventures, and strategic alliances may have an adverse effect on our business.
 We expect to continue making acquisitions and entering into joint ventures and strategic alliances as part of our long-term business strategy. 
For example
, in March 2021 we completed our acquisition of ZeniMax Media Inc. 
for $8.1 billion, and in March 2022 we completed our acquisition of Nuance Communications, Inc. for $18.8 billion. In January 2022 we announced a definitive agreement to acquire Activision Blizzard, Inc. for $68.7
 billion. These acquisitions and other transactions and arrangements involve significant challenges and risks, including that they do not advance our business strategy, that we get an unsatisfactory return on our investment, that they raise new compliance-related obligations and challenges, that we have difficulty integrating and retaining new employees, business systems, and technology, that they distract management from our other businesses, or that announced transactions may not be completed. If an arrangement fails to adequately anticipate changing circumstances and interests of a party, it may result in early termination or renegotiation of the arrangement. The success of these transactions and arrangements will depend in part on our ability to leverage them to enhance our existing products and services or develop compelling new ones, as well as acquired companies’ ability to meet our policies and processes in areas such as data governance, privacy, and cybersecurity. It may take longer than expected to realize the full benefits from these transactions and arrangements such as increased revenue or enhanced efficiencies, or the benefits may ultimately be smaller than we expected. These events could adversely affect our consolidated financial statements.",10,9,258,38.75968992248062,34.883720930232556,228,7,7,30.70175438596491,30.70175438596491,26,3,2,115.38461538461539,76.92307692307692,0.8181818181818182,0.0,0.01670108176767826,0.8345808386802673,0.14871810376644135
MSFT,MICROSOFT CORP,0000789019,10-Q,2023-01-24,000156459023000733,16,"If our goodwill or amortizable intangible assets become impaired, we may be required to record a significant charge to earnings.
 We acquire other companies and intangible assets and may not realize all the economic benefit from those acquisitions, which could cause an impairment of goodwill or intangibles. We review our amortizable intangible assets for impairment when events or changes in circumstances indicate the carrying value may not be recoverable. We test goodwill for impairment at least annually. Factors that may be a change in circumstances, indicating that the carrying value of our goodwill or amortizable intangible assets may not be recoverable, include a decline in our stock price and market capitalization, reduced future cash flow estimates, and slower growth rates in industry segments in which we participate. We 
have in the past recorded, and may in the future
 be required to record
,
 a significant charge 
in
 our consolidated financial statements during the period in which any impairment of our goodwill or amortizable intangible assets is determined, negatively affecting our results of operations.",8,13,168,47.61904761904762,77.38095238095238,150,8,12,53.333333333333336,80.0,16,0,1,0.0,62.5,0.6666666666666666,0.0,0.01780836470425129,0.8705050349235535,0.1116865873336792
MSFT,MICROSOFT CORP,0000789019,10-Q,2023-01-24,000156459023000733,17,"CYBERSECURITY, DATA PRIVACY, AND PLATFORM ABUSE RISKS",1,1,7,142.85714285714286,142.85714285714286,0,0,0,0.0,0.0,7,1,1,142.85714285714286,142.85714285714286,0.0,0.0,0.021426796913146973,0.3519172668457031,0.6266559362411499
MSFT,MICROSOFT CORP,0000789019,10-Q,2023-01-24,000156459023000733,18,"Cyberattacks and security vulnerabilities could lead to reduced revenue, increased costs, liability claims, or harm to our reputation or competitive position.",4,1,21,190.47619047619048,47.61904761904762,21,4,1,190.47619047619048,47.61904761904762,0,0,0,0.0,0.0,1.0,0.0,0.00986996479332447,0.9655466079711914,0.02458340860903263
MSFT,MICROSOFT CORP,0000789019,10-Q,2023-01-24,000156459023000733,19,Security of our information technology,0,0,5,0.0,0.0,5,0,0,0.0,0.0,0,0,0,0.0,0.0,1.0,0.0,0.050908684730529785,0.02261553704738617,0.9264757633209229
MSFT,MICROSOFT CORP,0000789019,10-Q,2023-01-24,000156459023000733,20,"Threats to IT security can take a variety of forms. Individual and groups of hackers and sophisticated organizations, including state-sponsored organizations or nation-states, continuously undertake attacks that pose threats to our customers and our IT. These actors may use a wide variety of methods, which may include developing and deploying malicious software or exploiting vulnerabilities or intentionally designed processes in hardware, software, or other infrastructure in order to attack our products and services or gain access to our networks and datacenters, using social engineering techniques to induce our employees, users, partners, or customers to disclose passwords or other sensitive information or take other actions to gain access to our data or our users’ or customers’ data, or acting in a coordinated manner to launch distributed denial of service or other coordinated attacks. Nation-state and state-sponsored actors can deploy significant resources to plan and carry out attacks. Nation-state attacks against us, our customers, or our partners may intensify during periods of intense diplomatic or armed conflict, such as the ongoing conflict in Ukraine. Inadequate account security or organizational security practices may also result in unauthorized access to confidential data. For example, system administrators may fail to timely remove employee account access when no longer appropriate. Employees or third parties may intentionally compromise our or our users’ security or systems or reveal confidential information. Malicious actors may employ the IT supply chain to introduce malware through software updates or compromised supplier accounts or hardware.",14,7,239,58.57740585774059,29.288702928870293,164,9,4,54.8780487804878,24.390243902439025,75,5,3,66.66666666666667,40.0,0.4444444444444444,0.1111111111111111,0.019144896417856216,0.6114541292190552,0.3694009780883789
MSFT,MICROSOFT CORP,0000789019,10-Q,2023-01-24,000156459023000733,21,"Cyberthreats are constantly evolving and becoming increasingly sophisticated and complex, increasing the difficulty of detecting and successfully defending against them. We may have no current capability to detect certain vulnerabilities or new attack methods, which may allow them to persist in the environment over long periods of time. Cyberthreats can have cascading impacts that unfold with increasing speed across our internal networks and systems and those of our partners and customers. Breaches of our facilities, network, or data security could disrupt the security of our systems and business applications, impair our ability to provide services to our customers and protect the privacy of their data, result in product development delays, compromise confidential or technical business information harming our reputation or competitive position, result in theft or misuse of our intellectual property or other assets, subject us to ransomware attacks, require us to allocate more resources to improve technologies or remediate the impacts of attacks, or otherwise adversely affect our business.",12,3,160,75.0,18.75,140,9,3,64.28571428571429,21.428571428571427,20,3,0,150.0,0.0,0.75,0.0,0.011257690377533436,0.9005834460258484,0.08815891295671463
MSFT,MICROSOFT CORP,0000789019,10-Q,2023-01-24,000156459023000733,22,"The cyberattacks uncovered in late 2020 known as “Solorigate” or “Nobelium” are an example of a supply chain attack where malware was introduced to a software provider’s customers, including us, through software updates. The attackers were later able to create false credentials that appeared legitimate to certain customers’ systems. We may be targets of further attacks similar to Solorigate/Nobelium as both a supplier and consumer of IT. With long-term attacks like these, customers may lack the log data necessary to investigate this type of activity, adding to the complexity of response and mitigating any impact.",6,3,92,65.21739130434783,32.608695652173914,48,3,1,62.5,20.833333333333332,44,3,2,68.18181818181819,45.45454545454545,0.5,0.5,0.03139270097017288,0.4406625032424927,0.527944803237915
MSFT,MICROSOFT CORP,0000789019,10-Q,2023-01-24,000156459023000733,23,"In addition, our internal IT environment continues to evolve. Often, we are early adopters of new devices and technologies. We embrace new ways of sharing data and communicating internally and with partners and customers using methods such as social networking and other consumer-oriented technologies. Our business policies and internal security controls may not keep pace with these changes as new threats emerge, or emerging cybersecurity regulations in jurisdictions worldwide.",1,1,69,14.492753623188406,14.492753623188406,69,1,1,14.492753623188406,14.492753623188406,0,0,0,0.0,0.0,1.0,0.0,0.18032081425189972,0.0449785478413105,0.7747006416320801
MSFT,MICROSOFT CORP,0000789019,10-Q,2023-01-24,000156459023000733,24,"Security of our products, services, devices, and customers’ data",0,0,9,0.0,0.0,9,0,0,0.0,0.0,0,0,0,0.0,0.0,1.0,0.0,0.04638952761888504,0.01800697110593319,0.9356034994125366
MSFT,MICROSOFT CORP,0000789019,10-Q,2023-01-24,000156459023000733,25,"The security of our products and services is important in our customers’ decisions to purchase or use our products or services across cloud and on-premises environments. Security threats are a significant challenge to companies like us whose business is providing technology products and services to others. Threats to our own IT infrastructure can also affect our customers. Customers using our cloud-based services rely on the security of our infrastructure, including hardware and other elements provided by third parties, to ensure the reliability of our services and the protection of their data. Adversaries tend to focus their efforts on the most popular operating systems, programs, and services, including many of ours, and we expect that to continue. In addition, adversaries can attack our customers’ on-premises or cloud environments, sometimes exploiting previously unknown (“zero day”) vulnerabilities, such as occurred in early calendar year 2021 with several of our Exchange Server on-premises products. Vulnerabilities in these or any product can persist even after we have issued security patches if customers have not installed the most recent updates, or if the attackers exploited the vulnerabilities before patching to install additional malware to further compromise customers’ systems. Adversaries will continue to attack customers using our cloud services as customers embrace digital transformation. Adversaries that acquire user account information can use that information to compromise our users’ accounts, including where accounts share the same attributes such as passwords. Inadequate account security practices may also result in unauthorized access, and user activity may result in ransomware or other malicious software impacting a customer’s use of our products or services. We are increasingly incorporating open source software into our products. There may be vulnerabilities in open source software that may make our products susceptible to cyberattacks.",19,6,285,66.66666666666667,21.05263157894737,285,19,6,66.66666666666667,21.05263157894737,0,0,0,0.0,0.0,1.0,0.0,0.03143078088760376,0.4517660140991211,0.5168031454086304
MSFT,MICROSOFT CORP,0000789019,10-Q,2023-01-24,000156459023000733,26,"Our customers operate complex IT systems with third-party hardware and software from multiple vendors that may include systems acquired over many years. They expect our products and services to support all these systems and products, including those that no longer incorporate the strongest current security advances or standards. As a result, we may not be able to discontinue support in our services for a product, service, standard, or feature solely because a more secure alternative is available. Failure to utilize the most current security advances and standards can increase our customers’ vulnerability to attack. Further, customers of widely varied size and technical sophistication use our technology, and consequently may have limited capabilities and resources to help them adopt and implement state of the art cybersecurity practices and technologies. In addition, we must account for this wide variation of technical sophistication when defining default settings for our products and services, including security default settings, as these settings may limit or otherwise impact other aspects of IT operations and some customers may have limited capability to review and reset these defaults.",6,7,176,34.09090909090909,39.77272727272727,176,6,7,34.09090909090909,39.77272727272727,0,0,0,0.0,0.0,1.0,0.0,0.021382950246334076,0.7417250871658325,0.2368919998407364
MSFT,MICROSOFT CORP,0000789019,10-Q,2023-01-24,000156459023000733,27,"Cyberattacks such as Solorigate/Nobelium may adversely impact our customers even if our production services are not directly compromised. We are committed to notifying our customers whose systems have been impacted as we become aware and have actionable information for customers to help protect themselves. We are also committed to providing guidance and support on detection, tracking, and remediation. We may not be able to detect the existence or extent of these attacks for all of our customers or have information on how to detect or track an attack, especially where an attack involves on-premises software such as Exchange Server where we may have no or limited visibility into our customers’ computing environments.",2,3,113,17.699115044247787,26.548672566371682,113,2,3,17.699115044247787,26.548672566371682,0,0,0,0.0,0.0,1.0,0.0,0.03513862192630768,0.1499808430671692,0.8148804903030396
MSFT,MICROSOFT CORP,0000789019,10-Q,2023-01-24,000156459023000733,28,Development and deployment of defensive measures,1,0,6,166.66666666666666,0.0,0,0,0,0.0,0.0,6,1,0,166.66666666666666,0.0,0.0,0.0,0.06277818977832794,0.017061375081539154,0.9201604723930359
MSFT,MICROSOFT CORP,0000789019,10-Q,2023-01-24,000156459023000733,29,"To defend against security threats to our internal IT systems, our cloud-based services, and our customers’ systems, we must continuously engineer more secure products and services, enhance security and reliability features, improve the deployment of software updates to address security vulnerabilities in our own products as well as those provided by others, develop mitigation technologies that help to secure customers from attacks even when software updates are not deployed, maintain the digital security infrastructure that protects the integrity of our network, products, and services, and provide security tools such as firewalls, anti-virus software, and advanced security and information about the need to deploy security measures and the impact of doing so. Customers in certain industries such as financial services, health care, and government may have enhanced or specialized requirements to which we must engineer our products and services.",4,1,138,28.985507246376812,7.246376811594203,138,4,1,28.985507246376812,7.246376811594203,0,0,0,0.0,0.0,1.0,0.0,0.4340563416481018,0.012198364362120628,0.5537453293800354
