ticker,company_title,cik,form,filing_date,accession,para_idx,para_text,neg_cnt,unc_cnt,n_tokens,neg_per_1000,unc_per_1000,company_tokens,company_neg_cnt,company_unc_cnt,company_neg_per_1000,company_unc_per_1000,external_tokens,external_neg_cnt,external_unc_cnt,external_neg_per_1000,external_unc_per_1000,company_sent_ratio,external_sent_ratio,finbert_neg,finbert_neu,finbert_pos
MSFT,MICROSOFT CORP,0000789019,10-K,2022-07-28,000156459022026876,56,"We may have additional tax liabilities.
 We are subject to income taxes in the U.S. and many foreign jurisdictions. Significant judgment is required in determining our worldwide provision for income taxes. In the course of our business, there are many transactions and calculations where the ultimate tax determination is uncertain. For example, compliance with the 2017 United States Tax Cuts and Jobs Act (“TCJA”) and possible future legislative changes may require the collection of information not regularly produced within the Company, the use of estimates in our consolidated financial statements, and the exercise of significant judgment in accounting for its provisions. As regulations and guidance evolve with respect to the TCJA or possible future legislative changes, and as we gather more information and perform more analysis, our results may differ from previous estimates and may materially affect our consolidated financial statements.",0,8,139,0.0,57.55395683453237,135,0,8,0.0,59.25925925925926,4,0,0,0.0,0.0,0.8571428571428571,0.0,0.03302093967795372,0.2797969877719879,0.6871820688247681
MSFT,MICROSOFT CORP,0000789019,10-K,2022-07-28,000156459022026876,57,"We regularly are under audit by tax authorities in different jurisdictions. Although we believe that our provision for income taxes and our tax estimates are reasonable, tax authorities may disagree with certain positions we have taken. In addition, economic and political pressures to increase tax revenue in various jurisdictions may make resolving tax disputes favorably more difficult. We are currently under Internal Revenue Service audit for prior tax years, with the primary unresolved issues relating to transfer pricing. The final resolution of those audits, and other audits or litigation, may differ from the amounts recorded in our consolidated financial statements and may materially affect our consolidated financial statements in the period or periods in which that determination is made.",5,6,119,42.016806722689076,50.42016806722689,98,3,5,30.612244897959183,51.02040816326531,21,2,1,95.23809523809524,47.61904761904762,0.8,0.0,0.022281402722001076,0.6836681962013245,0.294050395488739
MSFT,MICROSOFT CORP,0000789019,10-K,2022-07-28,000156459022026876,58,"We earn a significant amount of our operating income outside the U.S. A change in the mix of earnings and losses in countries with differing statutory tax rates, changes in our business or structure, or the expiration of or disputes about certain tax agreements in a particular country may result in higher effective tax rates for the Company. In addition, changes in U.S. federal and state or international tax laws applicable to corporate multinationals, other fundamental law changes currently being considered by many countries, including in the U.S., and changes in taxing jurisdictions’ administrative interpretations, decisions, policies, and positions may materially adversely impact our consolidated financial statements.",3,3,101,29.702970297029704,29.702970297029704,97,3,3,30.927835051546392,30.927835051546392,4,0,0,0.0,0.0,0.75,0.0,0.019548622891306877,0.8452930450439453,0.1351582556962967
MSFT,MICROSOFT CORP,0000789019,10-K,2022-07-28,000156459022026876,59,"We may not be able to protect our source code from copying if there is an unauthorized disclosure.
 Source code, the detailed program commands for our operating systems and other software programs, is critical to our business. Although we license portions of our application and operating system source code to several licensees, we take significant measures to protect the secrecy of large portions of our source code. If our source code leaks, we might lose future trade secret protection for that code. It may then become easier for third parties to compete with our products by copying functionality, which could adversely affect our revenue and operating margins. Unauthorized disclosure of source code also could increase the security risks described elsewhere in these risk factors.",6,7,124,48.38709677419355,56.45161290322581,107,5,4,46.728971962616825,37.38317757009346,17,1,3,58.8235294117647,176.47058823529412,0.8333333333333334,0.0,0.024628138169646263,0.7027215957641602,0.27265024185180664
MSFT,MICROSOFT CORP,0000789019,10-K,2022-07-28,000156459022026876,60,"Legal changes, our evolving business model, piracy, and other factors may decrease the value of our intellectual property. 
Protecting our intellectual property rights and combating unlicensed copying and use of our software and other intellectual property on a global basis is difficult. While piracy adversely affects U.S. revenue, the impact on revenue from outside the U.S. is more significant, particularly countries in which the legal system provides less protection for intellectual property rights. Our revenue in these markets may grow more slowly than the underlying device market. Similarly, the absence of harmonized patent laws makes it more difficult to ensure consistent respect for patent rights. Throughout the world, we educate users about the benefits of licensing genuine products and obtaining indemnification benefits for intellectual property risks, and we educate lawmakers about the advantages of a business climate where intellectual property rights are protected. Reductions in the legal protection for software intellectual property rights could adversely affect revenue.",7,4,153,45.751633986928105,26.143790849673202,92,3,3,32.608695652173914,32.608695652173914,61,4,1,65.57377049180327,16.39344262295082,0.4444444444444444,0.1111111111111111,0.04373753443360329,0.7769377827644348,0.1793246567249298
MSFT,MICROSOFT CORP,0000789019,10-K,2022-07-28,000156459022026876,61,"We expend significant resources to patent the intellectual property we create with the expectation that we will generate revenues by incorporating that intellectual property in our products or services or, in some instances, by licensing or cross-licensing our patents to others in return for a royalty and/or increased freedom to operate. Changes in the law may continue to weaken our ability to prevent the use of patented technology or collect revenue for licensing our patents. These include legislative changes and regulatory actions that make it more difficult to obtain injunctions, and the increasing use of legal process to challenge issued patents. Similarly, licensees of our patents may fail to satisfy their obligations to pay us royalties or may contest the scope and extent of their obligations. The royalties we can obtain to monetize our intellectual property may decline because of the evolution of technology, price changes in products using licensed patents, greater value from cross-licensing, or the difficulty of discovering infringements. Finally, our increasing engagement with open source software will also cause us to license our intellectual property rights broadly in certain situations and may negatively impact revenue.",9,5,188,47.87234042553192,26.595744680851062,162,6,5,37.03703703703704,30.864197530864196,26,3,0,115.38461538461539,0.0,0.8333333333333334,0.16666666666666666,0.017417067661881447,0.851784348487854,0.13079863786697388
MSFT,MICROSOFT CORP,0000789019,10-K,2022-07-28,000156459022026876,62,"Third parties may claim we infringe their intellectual property rights.
 From time to time, others claim we infringe their intellectual property rights. The number of these claims may grow because of constant technological change in the markets in which we compete, the extensive patent coverage of existing technologies, the rapid rate of issuance of new patents, and our offering of first-party devices, such as Surface. To resolve these claims, we may enter into royalty and licensing agreements on terms that are less favorable than currently available, stop selling or redesign affected products or services, or pay damages to satisfy indemnification commitments with our customers. These outcomes may cause operating margins to decline. Besides money damages, in some jurisdictions plaintiffs can seek injunctive relief that may limit or prevent importing, marketing, and selling our products or services that have infringing technologies. In some countries, such as Germany, an injunction can be issued before the parties have fully litigated the validity of the underlying patents. We have paid significant amounts to settle claims related to the use of technology and intellectual property rights and to procure intellectual property rights as part of our strategy to manage this risk, and may continue to do so.",12,7,202,59.40594059405941,34.65346534653465,171,9,6,52.63157894736842,35.08771929824562,31,3,1,96.7741935483871,32.25806451612903,0.75,0.0,0.02696598507463932,0.845185399055481,0.12784862518310547
MSFT,MICROSOFT CORP,0000789019,10-K,2022-07-28,000156459022026876,63,"If our reputation or our brands are damaged, our business and operating results may be harmed
. Our reputation and brands are globally recognized and are important to our business. Our reputation and brands affect our ability to attract and retain consumer, business, and public-sector customers. There are numerous ways our reputation or brands could be damaged. These include product safety or quality issues, our environmental impact and sustainability,
 
supply chain practices, or human rights record. We may experience backlash from customers, government entities, advocacy groups, employees, and other stakeholders that disagree with our product offering decisions or public policy positions. Damage to our reputation or our brands may occur from, among other things:",5,4,113,44.24778761061947,35.39823008849557,106,5,4,47.16981132075472,37.735849056603776,7,0,0,0.0,0.0,0.875,0.0,0.016322264447808266,0.8413439989089966,0.1423337161540985
MSFT,MICROSOFT CORP,0000789019,10-K,2022-07-28,000156459022026876,64,"The proliferation of social media may increase the likelihood, speed, and magnitude of negative brand events. If our brands or reputation are damaged, it could negatively impact our revenues or margins, or ability to attract the most highly qualified employees.",3,3,40,75.0,75.0,24,2,1,83.33333333333333,41.666666666666664,16,1,2,62.5,125.0,0.5,0.0,0.012249022722244263,0.9344983696937561,0.053252674639225006
MSFT,MICROSOFT CORP,0000789019,10-K,2022-07-28,000156459022026876,65,"Adverse economic or market conditions may harm our business.
 Worsening economic conditions, including inflation, recession, pandemic, or other changes in economic conditions, may cause lower IT spending and adversely affect our revenue. If demand for PCs, servers, and other computing devices declines, or consumer or business spending for those products declines, our revenue will be adversely affected.",8,2,57,140.35087719298247,35.08771929824562,57,8,2,140.35087719298247,35.08771929824562,0,0,0,0.0,0.0,1.0,0.0,0.008584443479776382,0.9562128782272339,0.035202670842409134
MSFT,MICROSOFT CORP,0000789019,10-K,2022-07-28,000156459022026876,66,"Our product distribution system relies on an extensive partner and retail network. OEMs building devices that run our software have also been a significant means of distribution. The impact of economic conditions on our partners, such as the bankruptcy of a major distributor, OEM, or retailer, could cause sales channel disruption.",2,1,49,40.816326530612244,20.408163265306122,49,2,1,40.816326530612244,20.408163265306122,0,0,0,0.0,0.0,1.0,0.0,0.01390515174716711,0.9121183156967163,0.07397664338350296
MSFT,MICROSOFT CORP,0000789019,10-K,2022-07-28,000156459022026876,67,"Challenging economic conditions also may impair the ability of our customers to pay for products and services they have purchased. As a result, allowances for doubtful accounts and write-offs of accounts receivable may increase.",3,3,33,90.9090909090909,90.9090909090909,20,2,1,100.0,50.0,13,1,2,76.92307692307692,153.84615384615384,0.5,0.0,0.010841922834515572,0.9644873142242432,0.024670783430337906
MSFT,MICROSOFT CORP,0000789019,10-K,2022-07-28,000156459022026876,68,"We maintain an investment portfolio of various holdings, types, and maturities. These investments are subject to general credit, liquidity, market, and interest rate risks, which may be exacerbated by market downturns or events that affect global financial markets. A significant part of our investment portfolio comprises U.S. government securities. If global financial markets decline for long periods, or if there is a downgrade of the U.S. government credit rating due to an actual or threatened default on government debt, our investment portfolio may be adversely affected and we could determine that more of our investments have experienced a decline in fair value, requiring impairment charges that could adversely affect our consolidated financial statements.",10,5,108,92.5925925925926,46.2962962962963,64,6,3,93.75,46.875,42,4,2,95.23809523809524,47.61904761904762,0.6,0.2,0.011353850364685059,0.9479547739028931,0.040691375732421875
MSFT,MICROSOFT CORP,0000789019,10-K,2022-07-28,000156459022026876,69,"Catastrophic events or geopolitical conditions may disrupt our business.
 A disruption or failure of our systems or operations because of a major earthquake, weather event, cyberattack, terrorist attack, pandemic, or other catastrophic event could cause delays in completing sales, providing services, or performing other critical functions. Our corporate headquarters, a significant portion of our research and development activities, and certain other essential business operations are in the Seattle, Washington area, and we have other business operations in the Silicon Valley area of California, both of which are seismically active regions. A catastrophic event that results in the destruction or disruption of any of our critical business or IT systems, or the infrastructure or systems they rely on, such as power grids, could harm our ability to conduct normal business operations. Providing our customers with more services and solutions in the cloud puts a premium on the resilience of our systems and strength of our business continuity management plans and magnifies the potential impact of prolonged service outages in our consolidated financial statements.",15,3,167,89.82035928143712,17.964071856287426,167,15,3,89.82035928143712,17.964071856287426,0,0,0,0.0,0.0,1.0,0.0,0.02101743035018444,0.7739793658256531,0.20500317215919495
MSFT,MICROSOFT CORP,0000789019,10-K,2022-07-28,000156459022026876,70,"Abrupt political change, terrorist activity, and armed conflict, such as the ongoing conflict in Ukraine, pose a risk of general economic disruption in affected countries, which may increase our operating costs and negatively impact our ability to sell to and collect from customers in affected markets. These conditions also may add uncertainty to the timing and budget for technology investment decisions by our customers and may cause supply chain disruptions for hardware manufacturers. Geopolitical change may result in changing regulatory systems and requirements and market interventions that could impact our operating strategies, access to national, regional, and global markets, hiring, and profitability. Geopolitical instability may lead to sanctions and impact our ability to do business in some markets or with some public-sector customers. Any of these changes may negatively impact our revenues.",8,10,131,61.06870229007634,76.33587786259542,131,8,10,61.06870229007634,76.33587786259542,0,0,0,0.0,0.0,1.0,0.0,0.009663070552051067,0.9456989765167236,0.044638000428676605
MSFT,MICROSOFT CORP,0000789019,10-K,2022-07-28,000156459022026876,71,"The occurrence of regional epidemics or a global pandemic such as COVID-19 may adversely affect our operations, financial condition, and results of operations. The COVID-19 pandemic has had widespread, rapidly evolving, and unpredictable impacts on global society, economies, financial markets, and business practices. The extent to which global pandemics impact our business going forward will depend on factors such as the duration and scope of the pandemic; governmental, business, and individuals' actions in response to the pandemic; and the impact on economic activity including the possibility of recession or financial market instability.",4,5,91,43.956043956043956,54.94505494505494,71,3,4,42.25352112676056,56.33802816901409,20,1,1,50.0,50.0,0.6666666666666666,0.3333333333333333,0.023132387548685074,0.4117836356163025,0.5650839805603027
MSFT,MICROSOFT CORP,0000789019,10-K,2022-07-28,000156459022026876,72,"Measures to contain 
a global pandemic
 
may 
intensify
 other risks described in these Risk Factors. Any of these 
measures
 
may adversely impact our ability to:",1,4,24,41.666666666666664,166.66666666666666,6,1,1,166.66666666666666,166.66666666666666,15,0,2,0.0,133.33333333333334,0.2,0.2,0.03112226165831089,0.4034806787967682,0.5653970241546631
MSFT,MICROSOFT CORP,0000789019,10-K,2022-07-28,000156459022026876,73,"We may incur increased costs to effectively manage these aspects of our business. If we are unsuccessful it may adversely impact our revenues, cash flows, market share growth, and reputation.",2,2,30,66.66666666666667,66.66666666666667,30,2,2,66.66666666666667,66.66666666666667,0,0,0,0.0,0.0,1.0,0.0,0.015555161982774734,0.9355242252349854,0.04892062395811081
MSFT,MICROSOFT CORP,0000789019,10-K,2022-07-28,000156459022026876,74,"The long-term effects of climate change on the global economy and the IT industry in particular are unclear. Environmental regulations or changes in the supply, demand or available sources of energy or other resources may affect the availability or cost of goods and services, including natural resources, necessary to run our business. Changes in climate where we operate may increase the costs of powering and cooling computer hardware we use to develop software and provide cloud-based services.",0,3,77,0.0,38.96103896103896,59,0,2,0.0,33.898305084745765,18,0,1,0.0,55.55555555555556,0.6666666666666666,0.3333333333333333,0.022720351815223694,0.6940997838973999,0.2831798493862152
MSFT,MICROSOFT CORP,0000789019,10-K,2022-07-28,000156459022026876,75,"Our global business exposes us to operational and economic risks.
 Our customers are located throughout the world and a significant part of our revenue comes from international sales. The global nature of our business creates operational, economic, and geopolitical risks. Our results of operations may be affected by global, regional, and local economic developments, monetary policy, inflation, and recession, as well as political and military disputes. In addition, our international growth strategy includes certain markets, the developing nature of which presents several risks, including deterioration of social, political, labor, or economic conditions in a country or region, and difficulties in staffing and managing foreign operations. Emerging nationalist and protectionist trends
 
and concerns about human rights and political expression in specific countries may significantly alter the trade and commercial environments. Changes to trade policy or agreements as a result of populism, protectionism, or economic nationalism may result in higher tariffs, local sourcing initiatives, and non-local sourcing restrictions, export controls, investment restrictions, or other developments that make it more difficult to sell our products in foreign countries. Disruptions of these kinds in developed or emerging markets could negatively impact demand for our products and services or increase operating costs. Although we hedge a portion of our international currency exposure, significant fluctuations in foreign exchange rates between the U.S. dollar and foreign currencies may adversely affect our results of operations.",10,10,222,45.04504504504504,45.04504504504504,198,9,9,45.45454545454545,45.45454545454545,24,1,1,41.666666666666664,41.666666666666664,0.8181818181818182,0.0,0.017135318368673325,0.854499101638794,0.1283656358718872
MSFT,MICROSOFT CORP,0000789019,10-K,2022-07-28,000156459022026876,76,"Our business depends on our ability to attract and retain talented employees.
 Our business is based on successfully attracting and retaining talented employees
 
representing diverse backgrounds, experiences, and skill sets. The market for highly skilled workers and leaders in our industry is extremely competitive. Maintaining our brand and reputation, as well as a diverse and inclusive work environment that enables all our employees to thrive, are important to our ability to recruit and retain employees. We are also limited in our ability to recruit internationally by restrictive domestic immigration laws. Changes to U.S. immigration policies that restrain the flow of technical and professional talent may inhibit our ability to adequately staff our research and development efforts. If we are less successful in our recruiting efforts, or if we cannot retain highly skilled workers and key leaders, our ability to develop and deliver successful products and services may be adversely affected. Effective succession planning is also important to our long-term success. Failure to ensure effective transfer of knowledge and smooth transitions involving key employees could hinder our strategic planning and execution. How employment-related laws are interpreted and applied to our workforce practices may result in increased operating costs and less flexibility in how we meet our workforce needs. Our global workforce is primarily non-unionized, but we have several unions and works councils outside of the United States. In the U.S., there has been a general increase in workers exercising their right to form or join a union. While Microsoft has not received such petitions in the U.S., the unionization of significant employee populations could result in higher costs and other operational changes necessary to respond to changing conditions and to establish new relationships with worker representatives.",3,6,279,10.75268817204301,21.50537634408602,253,3,6,11.857707509881424,23.715415019762847,26,0,0,0.0,0.0,0.8,0.0,0.014308733865618706,0.9204739928245544,0.0652172863483429
MSFT,MICROSOFT CORP,0000789019,10-K,2022-07-28,000156459022026876,77,"Item 1B, 2, 3, 4",0,0,1,0.0,0.0,0,0,0,0.0,0.0,1,0,0,0.0,0.0,0.0,0.0,0.019280729815363884,0.0555376335978508,0.9251816272735596
MSFT,MICROSOFT CORP,0000789019,10-Q,2022-04-26,000156459022015675,1,"Our operations and financial results are subject to various risks and uncertainties, including those described below, that could adversely affect our business, financial condition, results of operations, cash flows, and the trading price of our common stock.",1,3,37,27.027027027027028,81.08108108108108,37,1,3,27.027027027027028,81.08108108108108,0,0,0,0.0,0.0,1.0,0.0,0.021197810769081116,0.49855199456214905,0.48025017976760864
MSFT,MICROSOFT CORP,0000789019,10-Q,2022-04-26,000156459022015675,2,"We face intense competition across all markets for our products and services, which may lead to lower revenue or operating margins.",0,1,21,0.0,47.61904761904762,21,0,1,0.0,47.61904761904762,0,0,0,0.0,0.0,1.0,0.0,0.011374497786164284,0.9649162888526917,0.023709231987595558
MSFT,MICROSOFT CORP,0000789019,10-Q,2022-04-26,000156459022015675,3,Competition in the technology sector,0,0,5,0.0,0.0,0,0,0,0.0,0.0,5,0,0,0.0,0.0,0.0,0.0,0.13126273453235626,0.0308957751840353,0.8378415107727051
MSFT,MICROSOFT CORP,0000789019,10-Q,2022-04-26,000156459022015675,4,"Our competitors range in size from diversified global companies with significant research and development resources to small, specialized firms whose narrower product lines may let them be more effective in deploying technical, marketing, and financial resources. Barriers to entry in many of our businesses are low and many of the areas in which we compete evolve rapidly with changing and disruptive technologies, shifting user needs, and frequent introductions of new products and services. Our ability to remain competitive depends on our success in making innovative products, devices, and services that appeal to businesses and consumers.",2,2,95,21.05263157894737,21.05263157894737,95,2,2,21.05263157894737,21.05263157894737,0,0,0,0.0,0.0,1.0,0.0,0.2381293624639511,0.01148747093975544,0.750383198261261
MSFT,MICROSOFT CORP,0000789019,10-Q,2022-04-26,000156459022015675,5,"An important element of our business model has been to create platform-based ecosystems on which many participants can build diverse solutions. A well-established ecosystem creates beneficial network effects among users, application developers, and the platform provider that can accelerate growth. Establishing significant scale in the marketplace is necessary to achieve and maintain attractive margins. We face significant competition from firms that provide competing platforms.",0,0,63,0.0,0.0,31,0,0,0.0,0.0,32,0,0,0.0,0.0,0.5,0.25,0.5450028777122498,0.02744387835264206,0.42755326628685
MSFT,MICROSOFT CORP,0000789019,10-Q,2022-04-26,000156459022015675,6,Companies compete with us based on a growing variety of business models.,0,0,11,0.0,0.0,11,0,0,0.0,0.0,0,0,0,0.0,0.0,1.0,0.0,0.25240153074264526,0.008392219431698322,0.7392062544822693
